{
  "schema_version": "wizard_runlog.v1",
  "session_id": "a1c3ed00-a82d-4872-b18d-fa0cc4b2e4d4",
  "mode": "export",
  "final_status": "success",
  "blocked_reason": null,
  "duration_ms": 4.2400360107421875,
  "counts": {
    "steps_total": 6,
    "steps_complete": 0,
    "open_questions_total": 0,
    "open_questions_blocking": 0,
    "evidence_total": 0
  },
  "flags": {
    "has_blocking_open_questions": false,
    "has_evidence": false
  },
  "errors": [],
  "error_codes": [],
  "blueprint": null,
  "episode": null
}